{
  "schema_version": 1,
  "contract_id": "bangkok-rental-areas-v1",
  "site": {
    "origin": "https://thai-land.co.il",
    "locale": "he-IL",
    "direction": "rtl",
    "parent_route_id": "bangkok-apartment-rental",
    "parent_path": "/מדריך-להשכרת-דירה-בבנגקוק/"
  },
  "checked_on": "2026-08-10",
  "entity_policy": {
    "official_district_kind": "official_district",
    "market_area_kind": "market_area",
    "indexing_policy": "non_indexable_structured_entity",
    "relationship": "אזורי השוק מתארים חיפוש מגורים יומיומי ויכולים לחצות גבולות של מחוז רשמי אחד או יותר."
  },
  "public_labels": {
    "area_map_heading": "מפת אזורי המגורים בבנגקוק",
    "area_comparison_heading": "איפה כדאי לגור בבנגקוק לפי תקציב וסגנון חיים",
    "estimated_band_heading": "טווח שכירות חודשי משוער",
    "fit_heading": "למי האזור מתאים",
    "tradeoff_heading": "מה כדאי לקחת בחשבון",
    "micro_area_heading": "איפה להתמקד בתוך האזור",
    "daily_life_heading": "איך נראים חיי היום יום"
  },
  "pricing_method": {
    "pricing_method_id": "method:bangkok:rental-asking-bands",
    "public_label": "טווח שכירות חודשי משוער לקונדו מרוהט בחוזה טיפוסי של 12 חודשים, לפי מחירי פרסום שנבדקו ב-10 באוגוסט 2026",
    "currency": "THB",
    "unit": "month",
    "home_type": "condominium",
    "lease_basis": "typical_12_month_asking_price",
    "furnishing_basis": "furnished",
    "rounding_thb": 1000,
    "checked_on": "2026-08-10",
    "source_ids": [
      "source:propertyscout:bangkok-condos",
      "source:ddproperty:bangkok-condos",
      "source:propertyhub:bangkok-condos"
    ]
  },
  "source_catalog": [
    {
      "source_id": "source:bma:districts",
      "kind": "official_government",
      "name": "50 administrative districts of Bangkok",
      "publisher": "Bangkok Metropolitan Administration Open Government Data",
      "url": "https://data.bangkok.go.th/dataset/e537025b-1cf6-4c5b-8e46-c2e976f13283/resource/0f40f9b4-617b-46a9-8806-f590da610954/download/district.kml",
      "checked_on": "2026-08-10",
      "supports": [
        "official district count",
        "official district names",
        "administrative district boundaries"
      ]
    },
    {
      "source_id": "source:bma:district-vocabulary",
      "kind": "official_government",
      "name": "Bangkok district Thai and English vocabulary",
      "publisher": "Bangkok Metropolitan Administration International Affairs Office",
      "url": "https://iao.bangkok.go.th/content-list/157",
      "checked_on": "2026-08-10",
      "supports": [
        "official Thai district names",
        "official English district names",
        "district identity normalization"
      ]
    },
    {
      "source_id": "source:bma:district-overview",
      "kind": "official_government",
      "name": "Bangkok 50 district map overview",
      "publisher": "Bangkok Metropolitan Administration",
      "url": "https://district.bangkok.go.th/SEDPortal/50-map-overview/",
      "checked_on": "2026-08-10",
      "supports": [
        "official district organization",
        "district map context"
      ]
    },
    {
      "source_id": "source:bts:route-map",
      "kind": "official_operator",
      "name": "BTS route map",
      "publisher": "Bangkok Mass Transit System Public Company Limited",
      "url": "https://www.bts.co.th/btsroutes/btsroutes.pdf",
      "checked_on": "2026-08-10",
      "supports": [
        "BTS lines",
        "BTS station sequence",
        "BTS interchange context"
      ]
    },
    {
      "source_id": "source:bts:timetable",
      "kind": "official_operator",
      "name": "BTS station timetable and codes",
      "publisher": "Bangkok Mass Transit System Public Company Limited",
      "url": "https://www.bts.co.th/pdf/timetable.pdf",
      "checked_on": "2026-08-10",
      "supports": [
        "BTS station codes",
        "BTS station names"
      ]
    },
    {
      "source_id": "source:bem:blue-line",
      "kind": "official_operator",
      "name": "MRT Blue Line station map",
      "publisher": "Bangkok Expressway and Metro Public Company Limited",
      "url": "https://metro.bemplc.co.th/Line-Maps?Line=1&lang=en",
      "checked_on": "2026-08-10",
      "supports": [
        "MRT Blue Line station codes",
        "MRT Blue Line station names",
        "MRT station sequence"
      ]
    },
    {
      "source_id": "source:mrta:blue-line",
      "kind": "official_government",
      "name": "MRT Chaloem Ratchamongkhon Line",
      "publisher": "Mass Rapid Transit Authority of Thailand",
      "url": "https://www.mrta.co.th/en/mrt-chaloem-ratchamongkhon",
      "checked_on": "2026-08-10",
      "supports": [
        "MRT Blue Line authority",
        "current line scope"
      ]
    },
    {
      "source_id": "source:ocpb:residential-lease-2025",
      "kind": "official_government",
      "name": "Residential accommodation lease controlled-contract update",
      "publisher": "Office of the Consumer Protection Board",
      "url": "https://www.ocpb.go.th/news_view.php?nid=17943",
      "checked_on": "2026-08-10",
      "supports": [
        "2025 controlled-contract effective date and scope",
        "fair residential lease terms",
        "utility charge treatment"
      ]
    },
    {
      "source_id": "source:ocpb:standard-lease-2026",
      "kind": "official_government",
      "name": "OCPB standard residential lease example",
      "publisher": "Office of the Consumer Protection Board",
      "url": "https://www.ocpb.go.th/article_attach/articlefile_2026060814431516244.pdf",
      "checked_on": "2026-08-10",
      "supports": [
        "security-deposit return timing",
        "tenant-caused damage treatment",
        "ordinary wear treatment"
      ]
    },
    {
      "source_id": "source:immigration:tm30",
      "kind": "official_government",
      "name": "TM30 notification of residence for foreign nationals",
      "publisher": "Immigration Bureau of Thailand",
      "url": "https://tm30.immigration.go.th/TM30/Foreigner/TM30EN/index.html",
      "checked_on": "2026-08-10",
      "supports": [
        "TM30 responsible party",
        "TM30 notification deadline",
        "official online notification channel"
      ]
    },
    {
      "source_id": "source:revenue:lease-stamp-duty",
      "kind": "official_government",
      "name": "Thailand stamp duty schedule",
      "publisher": "Revenue Department of Thailand",
      "url": "https://www.rd.go.th/english/21986.html",
      "checked_on": "2026-08-10",
      "supports": [
        "lease stamp-duty rate",
        "stamp-duty calculation basis"
      ]
    },
    {
      "source_id": "source:propertyscout:bangkok-condos",
      "kind": "market_listings",
      "name": "Bangkok condominium rentals",
      "publisher": "PropertyScout",
      "url": "https://propertyscout.co.th/en/bangkok/rentals/condo/",
      "checked_on": "2026-08-10",
      "supports": [
        "current asking-price sample",
        "bedroom-level rental listings",
        "area-level rental listings"
      ]
    },
    {
      "source_id": "source:ddproperty:bangkok-condos",
      "kind": "market_listings",
      "name": "Bangkok condominium rental listings",
      "publisher": "DDproperty",
      "url": "https://www.ddproperty.com/en/condo-for-rent/in-bangkok-th10",
      "checked_on": "2026-08-10",
      "supports": [
        "current asking-price sample",
        "bedroom-level rental listings",
        "location comparison"
      ]
    },
    {
      "source_id": "source:propertyhub:bangkok-condos",
      "kind": "market_listings",
      "name": "Condominiums for rent",
      "publisher": "PropertyHub",
      "url": "https://propertyhub.in.th/en/condo-for-rent",
      "checked_on": "2026-08-10",
      "supports": [
        "current asking-price sample",
        "building-level rental listings",
        "area-level rental listings"
      ]
    }
  ],
  "current_facts": [
    {
      "fact_id": "fact:thailand:tm30-notification",
      "public_label": "הודעת מגורים TM30",
      "public_value": "בעל הבית, המחזיק בנכס או מנהל מקום האירוח שמארח אזרח זר באופן זמני צריך למסור הודעת TM30 להגירה בתוך 24 שעות מההגעה.",
      "effective_on": null,
      "checked_on": "2026-08-10",
      "source_ids": [
        "source:immigration:tm30"
      ]
    },
    {
      "fact_id": "fact:thailand:lease-controlled-contract",
      "public_label": "כללי חוזה שכירות מעודכנים",
      "public_value": "הודעת OCPB לעסקי השכרת מגורים מבוקרי חוזים נכנסה לתוקף ב-4 בספטמבר 2025, עם דרישה לחוזה ברור ולמסירת עותק לשוכר.",
      "effective_on": "2025-09-04",
      "checked_on": "2026-08-10",
      "source_ids": [
        "source:ocpb:residential-lease-2025"
      ]
    },
    {
      "fact_id": "fact:thailand:lease-controlled-scope",
      "public_label": "על אילו משכירים חלים הכללים",
      "public_value": "הודעת OCPB חלה על מפעיל שמשכיר שלוש יחידות מגורים או יותר, בבניין אחד או בכמה בניינים. בתי מלון ומעונות הכפופים לחוקים ייעודיים אינם נכללים.",
      "effective_on": "2025-09-04",
      "checked_on": "2026-08-10",
      "source_ids": [
        "source:ocpb:residential-lease-2025"
      ]
    },
    {
      "fact_id": "fact:thailand:lease-upfront-limit",
      "public_label": "שכר דירה מראש ופיקדון",
      "public_value": "בעסק שכירות שנכלל בהודעת OCPB, הסכום המצטבר של שכר דירה מראש ופיקדון אינו יכול לעלות על שלושה חודשי שכירות.",
      "effective_on": "2025-09-04",
      "checked_on": "2026-08-10",
      "source_ids": [
        "source:ocpb:residential-lease-2025"
      ]
    },
    {
      "fact_id": "fact:thailand:lease-utility-charges",
      "public_label": "חיובי מים וחשמל בחוזה",
      "public_value": "בעסק שכירות שנכלל בהודעת OCPB, חיובי מים וחשמל צריכים להיות שקופים ולא לעלות על התעריפים שגובים ספקי השירות הרלוונטיים.",
      "effective_on": "2025-09-04",
      "checked_on": "2026-08-10",
      "source_ids": [
        "source:ocpb:residential-lease-2025"
      ]
    },
    {
      "fact_id": "fact:thailand:lease-stamp-duty",